{
  "bootstrap": {
    "degenerate_trials": 0,
    "parameter_stddev": [
      0.002794779112013438,
      0.002220500776258407,
      0.004454673436507716,
      0.009764041734714323,
      0.007887833863394636,
      0.005112824729137088,
      0.0030724188490141805,
      0.001457977715113578,
      0.0021207203027954666,
      0.01193808593183497,
      0.007759403770481164,
      0.010348491761484115
    ],
    "requested_trials": 50,
    "successful_trials": 50
  },
  "content_sha256": "3520a1e965722362f1b7a63e722bb4f1495fbe5eaff4ef1a7471f63027ba384f",
  "dataset_sha256": "8369ba65246418f0f0844a6adfde173b19fb9ff542ca95497dc5253cf518cf11",
  "holdout_capture_ids": [
    "capture_008",
    "capture_013",
    "capture_017",
    "capture_018",
    "capture_019",
    "capture_021",
    "capture_026",
    "capture_030"
  ],
  "provenance": {
    "calibration_arm": "left",
    "command": "g1-calib solve",
    "dataset_path": "/home/kanth042/robot-calibration-aprilcube-prototype/sessions/manual_run_001/dataset.json",
    "initial_camera": "official_urdf_nominal_d435_optical",
    "initial_target": "rectified_pnp_sample_0"
  },
  "residual_summary": {
    "calibration_joint_correlations": {
      "left_elbow_joint": {
        "mean_u": -0.31109387571255837,
        "mean_v": 0.05536600377120488,
        "rms_radial": -0.5980167536677391
      },
      "left_shoulder_pitch_joint": {
        "mean_u": -0.5896602391163323,
        "mean_v": -0.6962825898379835,
        "rms_radial": -0.14669488732482042
      },
      "left_shoulder_roll_joint": {
        "mean_u": 0.14052771321517424,
        "mean_v": 0.16298524782892673,
        "rms_radial": -0.19093698833416345
      },
      "left_shoulder_yaw_joint": {
        "mean_u": -0.26633862731298075,
        "mean_v": 0.09708616804938339,
        "rms_radial": -0.11215682479179007
      },
      "left_wrist_pitch_joint": {
        "mean_u": 0.5461627578200099,
        "mean_v": 0.3393663780696896,
        "rms_radial": -0.12343625269047062
      },
      "left_wrist_roll_joint": {
        "mean_u": -0.1900361105623206,
        "mean_v": -0.07681975368215746,
        "rms_radial": -0.2286643199967157
      },
      "left_wrist_yaw_joint": {
        "mean_u": -0.5572278456319503,
        "mean_v": -0.527373772541608,
        "rms_radial": -0.4240827796530411
      }
    },
    "holdout": {
      "corner_count": 68,
      "maximum_px": 11.666303377953751,
      "median_px": 4.150988285120775,
      "p95_px": 10.330105384752223,
      "rms_px": 5.858670777494583
    },
    "per_capture_rms_px": {
      "capture_001": 3.6071429537931463,
      "capture_002": 6.489522123835694,
      "capture_003": 9.363553865862489,
      "capture_004": 7.855927950813964,
      "capture_005": 9.439047718587325,
      "capture_006": 2.2976931634239497,
      "capture_007": 7.0638895099067485,
      "capture_008": 7.348246554566053,
      "capture_009": 8.762803671694963,
      "capture_010": 5.989854474227104,
      "capture_011": 2.778230213544408,
      "capture_012": 2.7514070230172654,
      "capture_013": 4.793270669848635,
      "capture_014": 2.9755994192595856,
      "capture_015": 7.015910439696312,
      "capture_016": 24.81434708943888,
      "capture_017": 3.838645149952768,
      "capture_018": 6.883076181600736,
      "capture_019": 2.469497839411262,
      "capture_020": 7.152837091095622,
      "capture_021": 7.380479129262815,
      "capture_022": 19.723526478703544,
      "capture_023": 18.530003981924246,
      "capture_024": 11.327013686432876,
      "capture_025": 2.552178388775751,
      "capture_026": 2.565667207012437,
      "capture_027": 5.3271730980485446,
      "capture_028": 8.32909185701306,
      "capture_029": 6.585705723881619,
      "capture_030": 8.840246272298087,
      "capture_031": 8.17642531031656,
      "capture_032": 7.521725998101089,
      "capture_033": 3.1757764579222005,
      "capture_034": 2.668502976790957,
      "capture_035": 4.389266102702295,
      "capture_036": 7.617982184805506,
      "capture_037": 5.185076514533168,
      "capture_038": 4.666417234172789,
      "capture_039": 3.2626916254873346
    },
    "per_tag_rms_px": {
      "0": 16.1467788701518,
      "1": 8.039168055220559,
      "2": 25.639196343560783,
      "3": 7.517856277743902,
      "5": 8.329155553345936
    },
    "training": {
      "corner_count": 260,
      "maximum_px": 28.815469672640326,
      "median_px": 5.656367016010721,
      "p95_px": 21.339206385003784,
      "rms_px": 9.340100590470227
    }
  },
  "schema_version": 1,
  "solution": {
    "cost": 3808.3206006756686,
    "evaluations": 14,
    "hand_T_target": [
      [
        0.016280012986320702,
        0.999409967924104,
        0.03024363058739704,
        0.04333572982590172
      ],
      [
        0.029893003621997316,
        0.02974761784380836,
        -0.9991103480432351,
        0.028486750521853343
      ],
      [
        -0.9994205168554531,
        0.01716960239960269,
        -0.029391074186206234,
        0.0006001583288391668
      ],
      [
        0.0,
        0.0,
        0.0,
        1.0
      ]
    ],
    "message": "`ftol` termination condition is satisfied.",
    "observability": {
      "condition_number": 133.11437951321645,
      "observable": true,
      "parameter_count": 12,
      "parameter_stddev": [
        0.001339171043181272,
        0.0013994164775673115,
        0.002292838407638399,
        0.005249623196453393,
        0.0045270228302561,
        0.005058090866731199,
        0.0016973997894151412,
        0.0008738191033621853,
        0.0013844077842393224,
        0.01636494785402564,
        0.017945821061615217,
        0.018080762105214147
      ],
      "rank": 12,
      "singular_values": [
        42937.29063663892,
        36320.753398469744,
        14589.876012883002,
        10932.19954696353,
        6771.2408321233015,
        2790.40431391682,
        2473.765914916416,
        1246.5113359959348,
        1070.631335358144,
        512.0730501645116,
        371.6567718779974,
        322.5593718248586
      ]
    },
    "optimization_rms_px": 6.604448464485974,
    "parameters": {
      "hand_T_target_rx_rad": 1.2165927196538837,
      "hand_T_target_ry_rad": 1.2326149944429643,
      "hand_T_target_rz_rad": -1.160612565304387,
      "hand_T_target_tx_m": 0.04333572982590172,
      "hand_T_target_ty_m": 0.028486750521853343,
      "hand_T_target_tz_m": 0.0006001583288391668,
      "torso_T_camera_rx_rad": -1.8974144785955047,
      "torso_T_camera_ry_rad": 1.9416162482796906,
      "torso_T_camera_rz_rad": -0.5943634509342813,
      "torso_T_camera_tx_m": 0.06934192075473132,
      "torso_T_camera_ty_m": 0.04140578202307049,
      "torso_T_camera_tz_m": 0.4277960057387099
    },
    "success": true,
    "torso_T_camera": [
      [
        -0.03301707488774063,
        -0.8471644644960092,
        0.5303039155626206,
        0.06934192075473132
      ],
      [
        -0.9988489695319169,
        0.009497760225677838,
        -0.04701625905708748,
        0.04140578202307049
      ],
      [
        0.03479380448995126,
        -0.5312458589446936,
        -0.8465029406465341,
        0.4277960057387099
      ],
      [
        0.0,
        0.0,
        0.0,
        1.0
      ]
    ]
  },
  "training_capture_ids": [
    "capture_001",
    "capture_002",
    "capture_003",
    "capture_004",
    "capture_005",
    "capture_006",
    "capture_007",
    "capture_009",
    "capture_010",
    "capture_011",
    "capture_012",
    "capture_014",
    "capture_015",
    "capture_016",
    "capture_020",
    "capture_022",
    "capture_023",
    "capture_024",
    "capture_025",
    "capture_027",
    "capture_028",
    "capture_029",
    "capture_031",
    "capture_032",
    "capture_033",
    "capture_034",
    "capture_035",
    "capture_036",
    "capture_037",
    "capture_038",
    "capture_039"
  ]
}
